,name,location,rent,deposit,area,type,highlights,description,owner
485,Paranjape Blue Ridge,"2 BHK Flat for rent in Hinjewadi, Pune","₹35,003","+ Deposit ₹105,000","1,033 sqft",2 BHK ,"['2 Baths', 'North-East Facing']","A 2 bhk flat for rent in hinjewadi close to all basic civic amenities is available for just 35,003 in paranjape blue ridge, pune. This property is close to market. This flat consists of 2 bathrooms build in 1034 sq.Ft. Super built-Up area. The flat is built on 1034 sq.Ft. Area. Ease of access to 1 covered parking within society. This flat is situated at 4th in a tower with 30 floors. This is a ...",www.Azuro 
486,Godrej Elements,"3 BHK Flat for rent in Hinjewadi, Pune","₹43,002","+ Deposit ₹129,000","1,508 sqft",3 BHK ,"['3 Baths', 'North-East Facing']","A 3 bhk flat for rent in hinjewadi close to all basic civic amenities is available for just 43,002 in godrej elements, pune. The flat is close to market. This flat consists of 3 bathrooms build in 1508 sq.Ft. Super built-Up area. The flat is built on 1508 sq.Ft. Area. Ease of access to 1 covered parking within society. This flat is situated at 4th in a tower with 20 floors. This is a 1-5 years ...",www.Azuro 
487,Godrej Hillside 1,"3 BHK Flat for rent in Baner, Pune","₹32,002","+ Deposit ₹96,000",898 sqft,3 BHK ,"['3 Baths', 'North-East Facing']","Explore this amicable godrej hillside 1 of baner in pune ! Live in a 3 bhk flat for rent in baner spread over 898 sq.Ft. The flat is close to market. This flat consists of 3 bathrooms in 898 sq.Ft. Super built-Up area. The flat consists of 3 bedrooms, built on 898 sq.Ft. Society provides 1 covered parking with this flat. The building has a total of 18 floors and this property is situated on 5th...",www.Azuro 
488,Shapoorji Joyville,"2 BHK Flat for rent in Hinjewadi, Pune","₹24,002","+ Deposit ₹72,000",690 sqft,2 BHK ,"['2 Baths', 'North-East Facing']","A 2 bhk flat for rent in hinjewadi close to all basic civic amenities is available for just 24,002 in shapoorji joyville, pune. Property has attached 2 bathrooms with 2 rooms set in 690 sq.Ft. Super built-Up area. Flat is constructed on 690 sq.Ft. 1 covered parking available. Placed on 5th of 18 floor in 1-5 years old tower. This property is semi-Furnished. Equipped with 5 light, 4 fan, 2 geyse...",www.Azuro 
489,Supreme Amadore,"4 BHK Flat for rent in Baner, Pune",₹1.85 Lac,"+ Deposit ₹555,000","3,200 sqft",4 BHK ,"['4 Baths', 'North-East Facing']","Find this 4 bhk apartment for rent in baner, pune. This 4 bhk apartment in supreme amadore is situated in pune. Additionally, this property is in vicinity to important points of interest and is close to market. This 4 bhk flat comes with 4 bathrooms set in 3200 sq.Ft. Super built-Up usable area. The flat is built on 3200 sq.Ft. Area. Ease of access to 1 covered parking within society. This flat...",www.Azuro 
490,Shraddha Terraces,"2 BHK Flat for rent in Pimple Nilakh, Pune","₹28,002","+ Deposit ₹84,000","1,248 sqft",2 BHK ,"['2 Baths', 'North-East Facing']","Find this 2 bhk apartment for rent in pimple nilakh, pune. This 2 bhk apartment in shraddha terraces is situated in pune. This property offers access to nearby landmarks and is close to market. Property has 1248 sq.Ft. Super built-Up area with 2 bathrooms attached. The flat consists of 2 bedrooms, built on 1248 sq.Ft. Society provides 1 covered parking with this flat. The building has a total o...",www.Azuro 
491,Kolte Patil Life Republic Aros,"1 BHK Flat for rent in Hinjewadi, Pune","₹16,500","+ Deposit ₹48,000",450 sqft,1 BHK ,"['East Facing', 'Full Power Backup']",New contractions life republic kolte patil marunji,URBAN PROPERTIES  
492,Paranjape Blue Ridge The Promenade,"3 BHK Flat for rent in Hinjewadi, Pune","₹45,000","+ Deposit ₹135,000","1,660 sqft",3 BHK ,"['East Facing', 'Full Power Backup']","This 3 bhk flat in hinjewadi is available in paranjape blue ridge the promenade for rent, one of the most prominent projects for residential flats in pune. This flat consists of 3 bathrooms & 2 balconies build in 1530 sq.Ft. Super built-Up area. The flat is built on 1660 sq.Ft. Area. This property has pooja room and study room as well. Ease of access to 2 covered parking within society. This fl...",Sankalp Consultants Real Estate 
493,Kolte Patil Life Republic,"2 BHK Flat for rent in Hinjewadi, Pune","₹21,000",+ Deposit 3 months rent,800 sqft,2 BHK ,"['East Facing', 'Full Power Backup']","This lovely 2 bhk apartment for rent in hinjewadi is available in one of pune's most popular projects, kolte patil life republic. Property has 750 sq.Ft. Super built-Up area with 2 bathrooms & 1 balcony attached. The flat consists of 2 bedrooms, built on 800 sq.Ft. A separate space for others is available in this flat. Society provides 1 covered parking with this flat. The building has a total ...",Green Home Properties 
494,Paranjape Blue Ridge,"1 BHK Flat for rent in Hinjewadi, Pune","₹26,500","+ Deposit ₹50,000",750 sqft,1 BHK ,"['North Facing', 'Ground Floor']","Pune's most popular society paranjape blue ridge in hinjewadi offers 1 bhk apartment. The flat is close to metro station, close to school, close to hospital and close to market. Property has attached 1 bathroom & 1 balcony with 1 room set in 750 sq.Ft. Carpet area. The flat consists of 1 bedroom, built on 750 sq.Ft. Society provides 1 covered parking with this flat. The building has a total of ...",Lotlite Realtors Private Limited
495,Kolte Patil IVY Estate,"3 BHK Flat for rent in Wagholi, Pune","₹30,000","+ Deposit ₹90,000","1,585 sqft",3 BHK ,"['East Facing', 'Gated Society']","3 bhk semi furnised flat on rent prime location new brand flat in our society well maintain our society near shool ,collage , hospital , grocery market , with modular kitchen pl all amenities plz contact more details",MUTHA REALTY 
496,swapnmandir gruh rachana society Erandawane,"3 Bedroom House for rent in Erandwane, Pune","₹75,000",+ Deposit ₹4,"3,000 sqft",3 BHK ,"['North Facing', 'Close to School']","Bungalow for rent near khs school erandawane , for commercial use only like ca, architect office and small it company . Nice and calm location.",S Enterprise  
497,Nanded Madhuvanti,"2 BHK Flat for rent in Nanded, Pune","₹18,500","+ Deposit ₹50,000",938 sqft,2 BHK ,"['East Facing', 'Private Garden']","Nanded madhuvanti is one of pune's most sought after destination for residential flats and this 2 bhk flat for rent in nanded, is your opportunity to be a part of this community. This flat consists of 2 bathrooms & 1 balcony build in 740 sq.Ft. Carpet area. This property is constructed on 938 sq.Ft. You also get 1 covered parking inside the premises located on 5th of 11 floor. This is a ready t...",Vastulaxmi Properties 
498,Shreyas Colonnade,"2 BHK Flat for rent in Kharadi, Pune","₹38,000",+ Deposit 3 months rent,"1,100 sqft",2 BHK ,"['2 Baths', 'East Facing']","2 bhk fully furnished flat available on rent in kharadi.
It has 1 covered car parking.
For site visit kindly contact.",Gaurav Properties & Investment Consultants
499,Shree Sentosa Pride,"2 BHK Flat for rent in Punawale, Pune","₹21,000","+ Deposit ₹50,000","1,105 sqft",2 BHK ,"['East Facing', 'Fresh Construction']","This lovely 2 bhk apartment for rent in punawale is available in one of pune's most popular projects, shree sentosa pride. This flat consists of 2 bathrooms & 3 balconies build in 1105 sq.Ft. Super built-Up area. The flat is built on 1105 sq.Ft. Area. Ease of access to 1 covered parking within society. This flat is situated at 12th in a tower with 18 floors. This is a 0-1 year old society. This...",Royal Tech Properties Pvt. Ltd. 
500,Vilas Javdekar Yashwin Orizzonte,"2 BHK Flat for rent in Kharadi, Pune","₹35,000",+ Deposit 2 months rent,"1,000 sqft",2 BHK ,"['East Facing', 'Gated Society']","This 2 bhk flat in kharadi is available in vilas javdekar yashwin orizzonte for rent, one of the most prominent projects for residential flats in pune. This flat consists of 2 bathrooms & 1 balcony build in 1000 sq.Ft. Carpet area. Flat is constructed on 1000 sq.Ft. 1 covered parking available. 1 open parking available. Placed on 6th of 22 floor. This is a semi-Furnished flat. Furnishing option...",NESTAWAY TECHNOLOGIES PRIVATE LIMITED 
501,Majestique Manhattan,"1 BHK Flat for rent in Wagholi, Pune","₹14,999","+ Deposit ₹30,000",640 sqft,1 BHK ,"['East Facing', 'Gated Society']","Majestique manhattan is one of pune's most sought after destination for residential flats and this 1 bhk flat for rent in wagholi with 580 sq.Ft., is your opportunity to be a part of this community. Property has attached 1 bathroom & 1 balcony with 1 room set in 580 sq.Ft. Super built-Up area. This property is constructed on 640 sq.Ft. Extra space for others. You also get 1 covered parking insi...",M/S Sai Homes 1 
502,Shapoorji Joyville,"2 BHK Flat for rent in Hinjewadi, Pune","₹23,000","+ Deposit ₹50,000",710 sqft,2 BHK ,"['2 Baths', 'Full Power Backup']","A 2 bhk flat for rent in hinjewadi close to all basic civic amenities is available for just 23,000 in shapoorji joyville, pune. Additionally, this property is in vicinity to important points of interest and is close to metro station, close to hospital, close to school and close to market. Property has attached 2 bathrooms & 1 balcony with 2 rooms set in 710 sq.Ft. Carpet area. The flat is built...",Lotlite Realtors Private Limited
503,Paranjape Blue Ridge,"1 BHK Flat for rent in Hinjewadi, Pune","₹22,500","+ Deposit ₹50,000",510 sqft,1 BHK ,"['1 Baths', 'Full Power Backup']",Explore this amicable paranjape blue ridge of hinjewadi in pune ! Live in a 1 bhk flat for rent in hinjewadi. This flat consists of 1 bathroom & 1 balcony in 510 sq.Ft. Carpet area. This flat is constructed on 510 sq.Ft. Area. An independent pooja room is available in this property. This flat lies on the 22nd floor of a 30 storey building. Well maintained 1-5 years property. Unfurnished flat pr...,Lotlite Realtors Private Limited
504,Paranjape Blue Ridge,"1 BHK Flat for rent in Hinjewadi, Pune","₹19,000","+ Deposit ₹40,000",442 sqft,1 BHK ,"['1 Baths', 'Private Garden']","A spacious 1 bhk flat for rent is available in hinjewadi in paranjape blue ridge, pune. This property is close to metro station. This flat consists of 1 bathroom & 1 balcony in 442 sq.Ft. Carpet area. Flat is constructed on 442 sq.Ft. 1 covered parking available. Placed on 15th of 30 floor in 1-5 years old tower. This is an unfurnished flat. The flat will be available from thu, 22 feb 2024 for ...",Lotlite Realtors Private Limited
505,Paranjape Blue Ridge,"2 BHK Flat for rent in Hinjewadi, Pune","₹33,000","+ Deposit ₹90,000",950 sqft,2 BHK ,"['2 Baths', 'Full Power Backup']","Pune's most popular society paranjape blue ridge in hinjewadi offers 2 bhk apartment. Additionally, this property is in vicinity to important points of interest and is close to metro station. This 2 bhk flat comes with 2 bathrooms set in 950 sq.Ft. Carpet usable area. The flat is built on 950 sq.Ft. Area. This property has pooja room as well. Ease of access to 1 covered parking within society. ...",Lotlite Realtors Private Limited
506,Rohan Prathama,"2 BHK Flat for rent in Hinjewadi, Pune","₹28,000","+ Deposit ₹50,000",741 sqft,2 BHK ,"['2 Baths', 'East Facing']","This 2 bhk flat in hinjewadi is available in rohan prathama for rent, one of the most prominent projects for residential flats in pune. Additionally, this property is in vicinity to important points of interest and is close to metro station, close to school, close to hospital and close to market. Property has 741 sq.Ft. Carpet area with 2 bathrooms & 1 balcony attached. This property is constru...",Lotlite Realtors Private Limited
507,Paranjape Blue Ridge,"1 BHK Flat for rent in Hinjewadi, Pune","₹25,000","+ Deposit ₹50,000",442 sqft,1 BHK ,"['1 Baths', 'East Facing']","Paranjape blue ridge is one of pune's most sought after destination for residential flats and this 1 bhk flat for rent in hinjewadi, is your opportunity to be a part of this community. The flat is close to metro station and close to school. This flat consists of 1 bathroom & 1 balcony build in 442 sq.Ft. Carpet area. Flat is constructed on 442 sq.Ft. 1 covered parking available. Placed on 24th ...",Lotlite Realtors Private Limited
508,Mantra Insignia,"3 BHK Flat for rent in Keshav Nagar, Pune","₹30,000",+ Deposit 2 months rent,"1,200 sqft",3 BHK ,"['East Facing', 'orbis school Nearby']",Budget friendly property which is located in very decsent area near market and kharadi and magarpatta itpark,Rakshak property 
509,Saakshi Parvasaakshi,"2 BHK Flat for rent in Pimple Saudagar, Pune","₹26,000","+ Deposit ₹75,000","1,250 sqft",2 BHK ,"['2 Baths', 'East Facing']",2.5bhk spacious flat is available for rent in a very beautiful & most demanded society located at shiv sai road in the prime location of the pimple saudagar.,Blue Sky Realtors 
510,Ganga New Town,"2 BHK Flat for rent in Dhanori, Pune","₹23,500",+ Deposit 3 months rent,"1,045 sqft",2 BHK ,"['2 Baths', 'East Facing']","Find this 2 bhk apartment for rent in dhanori, pune. This 2 bhk apartment in ganga new town is situated in pune. Property has 800 sq.Ft. Super built-Up area with 2 bathrooms & 2 balconies attached. The flat consists of 2 bedrooms, built on 1045 sq.Ft. A separate space for pooja room is available in this flat. Society provides 1 covered parking with this flat. The building has a total of 10 floo...",A1 Realties 
511,Bramha Sky City,"2 BHK Flat for rent in Dhanori, Pune","₹23,000","+ Deposit ₹60,000",971 sqft,2 BHK ,"['2 Baths', 'East Facing']","A 2 bhk flat for rent in dhanori close to all basic civic amenities is available for just 24,000 in bramha sky city, pune. The flat is close to school, close to airport and close to market. Property has 960 sq.Ft. Super built-Up area with 2 bathrooms & 2 balconies attached. This flat is constructed on 971 sq.Ft. Area. An independent pooja room is available in this property. This flat lies on th...",A1 Realties 
512,Kalpataru Enclave,"3 BHK Flat for rent in Wireless Colony, Pune","₹75,000",+ Deposit 4 months rent,"1,800 sqft",3 BHK ,"['3 Baths', 'East Facing']","Kalpataru enclave is one of pune's most sought after destination for residential flats and this 3 bhk flat for rent in wireless colony with 1700 sq.Ft., is your opportunity to be a part of this community. Property has 1700 sq.Ft. Super built-Up area with 3 bathrooms & 2 balconies attached. Flat is constructed on 1800 sq.Ft. 1 covered parking available. Placed on 9th of 11 floor in 10+ years old...",shikha properties  
513,Magnum Lifestyle,"2 BHK Flat for rent in Dhanori, Pune","₹24,000","+ Deposit ₹60,000",950 sqft,2 BHK ,"['2 Baths', 'East Facing']","A 2 bhk flat for rent in dhanori close to all basic civic amenities is available for just 24,000 in magnum lifestyle, pune. This property offers access to nearby landmarks and is close to market, close to airport and close to mall. This flat consists of 2 bathrooms & 2 balconies in 925 sq.Ft. Super built-Up area. The flat is built on 950 sq.Ft. Area. This property has pooja room as well. Ease o...",A1 Realties 
514,Anandtara Siliconbay,"3 BHK Flat for rent in Kalyani Nagar, Pune","₹50,000",+ Deposit 3 months rent,"1,501 sqft",3 BHK ,"['3 Baths', 'Fresh Construction']","Situated in kalyani nagar pune, anandtara siliconbay is a well planned, ready to move society that offers a pleasant living experience to its residents. This is a 3 bhk apartment now available for rent. Property has attached 3 bathrooms & 2 balconies with 3 rooms set in 1200 sq.Ft. Carpet area. Flat is constructed on 1501 sq.Ft. 1 covered parking available. Placed on 7th of 12 floor in 0-1 year...",Homebox Realtors  
515,Gayatri Bravuria Apartment,"2 BHK Flat for rent in Balewadi, Pune","₹34,000",+ Deposit 3 months rent,"1,200 sqft",2 BHK ,"['2 Baths', 'East Facing']",It's a fully furnished flat with the immediate possession it's very near from balewadi highstreet all market place are near to the society,Propkey Solution 
516,Pride Manhattan,"2 BHK Flat for rent in Lohegaon, Pune","₹26,000",+ Deposit 3 months rent,726 sqft,2 BHK ,"['2 Baths', 'East Facing']",2bhk full furnished flat available with all modern amenities and good connectivity.,HomeCraft Real estate & Interior Design 
517,Satyam Rajyog,"1 BHK Flat for rent in Dhanori, Pune","₹16,000","+ Deposit ₹50,000",600 sqft,1 BHK ,"['1 Baths', 'East Facing']","2bhk flat for rent in dhanori near ibm dash and commercial zone it park, huge society with all amenities like swimming pool club house children park lift with backup visitors parking etc near companies ibm,, dash, hsbc, cybage, deutsch bank, bajaj alliances tsc toshiba, deepak fertilizer, commerzone it park, airport walkable market transport bus stop auto stand 24hour water, security etc we hav...",Star properties  
518,BU Bhandari Rakshak Nagar,"2 BHK Flat for rent in Kharadi, Pune","₹26,500",+ Deposit 2 months rent,"1,100 sqft",2 BHK ,"['2 Baths', 'East Facing']","This lovely 2 bhk apartment for rent in kharadi is available in one of pune's most popular projects, bu bhandari rakshak nagar. Property has 780 sq.Ft. Carpet area with 2 bathrooms & 1 balcony attached. The flat is built on 1100 sq.Ft. Area. Ease of access to 1 covered parking within society. This flat is situated at 4th in a tower with 7 floors. This is a 5-10 years old society. This property ...",FORTUNE REALTY SOLUTIONS
519,Gulmohar Goldcoast,"2 BHK Flat for rent in Kharadi, Pune","₹28,000",+ Deposit 3 months rent,780 sqft,2 BHK ,"['2 Baths', 'East Facing']","This 2 bhk flat in kharadi is available in gulmohar goldcoast for rent, one of the most prominent projects for residential flats in pune. This flat consists of 2 bathrooms & 1 balcony in 780 sq.Ft. Carpet area. Flat is constructed on 780 sq.Ft. You get an additional space of others. 1 covered parking available. Placed on 6th of 10 floor in 5-10 years old tower. This property is unfurnished. Rea...",FORTUNE REALTY SOLUTIONS
520,Nyati Meadows 2,"2 BHK Flat for rent in Kalyani Nagar, Pune","₹45,000",+ Deposit 3 months rent,"1,150 sqft",2 BHK ,"['2 Baths', 'North-East Facing']",Beautiful 2 bedroom flat with open view in one of the best complex in wadgaon sheri. The flat is north facing fully furnished flat with modular kitchen with power backup ready to move in project they are offering all modern lifestyle as it is presented with many of the amenities. We have more options available in same serenity . Please feel free to contact us for more details.,Trinita Capital LLP
521,Panchshil Satellite Towers,"3 BHK Flat for rent in Mundhwa, Pune","₹80,000",+ Deposit 3 months rent,"2,100 sqft",3 BHK ,"['3 Baths', 'North-East Facing']",Beautiful 3 bedroom flat with open view in one of the best complex in pune the flat is north facing fully furnished flat with modular kitchen with power backup ready to move in project they are offering all modern lifestyle as it is presented with many of the amenities. We have more options available in same serenity . Please feel free to contact us for more details.,Trinita Capital LLP
522,Gera World of Joy,"3 BHK Flat for rent in Kharadi, Pune","₹45,000",+ Deposit 3 months rent,"1,100 sqft",3 BHK ,"['3 Baths', 'North-East Facing']",North faceing semi furnished flat with modular kitchen with power backup ready to move in project they are offering all modern lifestyle as it is presented with mang of the amenities ring me for more details,Trinita Capital LLP
523,Satyam Rajyog,"3 BHK Flat for rent in Dhanori, Pune","₹22,000","+ Deposit ₹60,000","1,200 sqft",3 BHK ,"['2 Baths', 'East Facing']","3bhk flat for rent in dhanori society name satyam rajyoga good society nearby all market 2 km
Airport 4km commerone it park business bay
Finex market city airomol ion it park",Star properties  
524,ganesh residency,"2 BHK Flat for rent in Wadgaon Sheri, Pune","₹24,000",+ Deposit 2 months rent,780 sqft,2 BHK ,"['2 Baths', 'Gated Society']","Ganesh residency is one of pune's most sought after destination for residential flats and this 2 bhk flat for rent in wadgaon sheri, is your opportunity to be a part of this community. This 2 bhk flat comes with 2 bathrooms set in 780 sq.Ft. Carpet usable area. Flat is constructed on 780 sq.Ft. You get an additional space of others. 1 covered parking available. Placed on 3rd of 6 floor in 1-5 y...",FORTUNE REALTY SOLUTIONS
525,Rama Erande Park,"2 BHK Flat for rent in Wadgaon Sheri, Pune","₹30,000",+ Deposit 2 months rent,"1,191 sqft",2 BHK ,"['2 Baths', 'East Facing']","Find this 2 bhk apartment for rent in wadgaon sheri, pune. This 2 bhk apartment in rama erande park is situated in pune. This 2 bhk flat comes with 2 bathrooms set in 780 sq.Ft. Carpet usable area. The flat consists of 2 bedrooms, built on 1191 sq.Ft. A separate space for others is available in this flat. Society provides 1 covered parking with this flat. The building has a total of 7 floors an...",FORTUNE REALTY SOLUTIONS
526,Sai Sundaram,"2 BHK Flat for rent in Kharadi, Pune","₹30,000",+ Deposit 2 months rent,641 sqft,2 BHK ,"['2 Baths', 'Full Power Backup']",Pune's most popular society sai sundaram in kharadi offers 2 bhk apartment. This 2 bhk flat comes with 2 bathrooms set in 60 sq.M. Carpet usable area. This property is constructed on 60 sq.M. Extra space for others. You also get 1 covered parking inside the premises located on 2nd of 5 floor. This is a ready to move property and it is 5-10 years old flat. This is a furnished flat. Already insta...,FORTUNE REALTY SOLUTIONS
527,Amar Landmark,"4 BHK Flat for rent in Baner, Pune",₹3.25 Lac,+ Deposit 6 months rent,"3,400 sqft",4 BHK ,"['4 Baths', 'East Facing']",Beautiful 4 bed room apartment is available for rentin one of the most prominent residential project amerlandmarks of pune city. Huge room sizes and immaculate planning. All top of the line premium amenities and specifications. Get in touch with us for more details and site visit. Baran properties. With you from selection to possession,Pioneer Rrealty 
528,shirsagar society ,"2 BHK Flat for rent in Senapati Bapat Road, Pune","₹35,000",+ Deposit 3 months rent,850 sqft,2 BHK ,"['2 Baths', 'East Facing']",Full furnished flat posh building available lift car park any call for more information,Shourya Realtors  
529,Ganga Alfa Paradise,"2 BHK Flat for rent in Wagholi, Pune","₹25,000","+ Deposit ₹50,000",917 sqft,2 BHK ,"['2 Baths', 'Full Power Backup']","Explore this amicable ganga alfa paradise of wagholi in pune ! Live in a 2 bhk flat for rent in wagholi spread over 890 sq.Ft. Property has attached 2 bathrooms & 1 balcony with 2 rooms set in 890 sq.Ft. Super built-Up area. The flat consists of 2 bedrooms, built on 917 sq.Ft. A separate space for others is available in this flat. Society provides 1 covered parking with this flat. The building ...",the idle door  
530,Mittal Sun Grandeur,"2 BHK Flat for rent in Patil Nagar, Pune","₹30,000","+ Deposit ₹100,000","1,390 sqft",2 BHK ,"['2 Baths', 'Top Floor']","A 2 bhk flat for rent in patil nagar close to all basic civic amenities is available for just 30,000 in mittal sun grandeur, pune. Property has 1390 sq.Ft. Super built-Up area with 2 bathrooms & 2 balconies attached. This property is constructed on 1390 sq.Ft. Extra space for others. You also get 1 covered parking inside the premises located on top of 12 floor. This is a ready to move property ...",Pune Realty 
531,Solitaire Residency,"2 BHK Flat for rent in Rahatani, Pune","₹25,500","+ Deposit ₹75,000","1,190 sqft",2 BHK ,"['2 Baths', 'East Facing']","Situated in rahatani pune, solitaire residency is a well planned, ready to move society that offers a pleasant living experience to its residents. This is a 1020 sq.Ft. Big 2 bhk apartment now available for rent. This flat consists of 2 bathrooms & 1 balcony in 1020 sq.Ft. Super built-Up area. The flat is built on 1190 sq.Ft. Area. This property has pooja room as well. Ease of access to 1 cover...",Vasturachna  Realty  
532,Marvel Ganga Fria Phase 1,"3 BHK Flat for rent in Wagholi, Pune","₹37,500",+ Deposit 3 months rent,"1,660 sqft",3 BHK ,"['3 Baths', 'East Facing']","Situated in wagholi pune, marvel ganga fria phase 1 is a well planned, ready to move society that offers a pleasant living experience to its residents. This is a 1505 sq.Ft. Big 3 bhk apartment now available for rent. This flat consists of 3 bathrooms & 1 balcony in 1505 sq.Ft. Super built-Up area. This property is constructed on 1660 sq.Ft. Extra space for others. You also get 1 covered parkin...",S.R Property Consultants 
533,Nyati Elysia,"2 BHK Flat for rent in Kharadi, Pune","₹33,000",+ Deposit 3 months rent,"1,150 sqft",2 BHK ,"['2 Baths', 'Private Garden']","A spacious 2 bhk flat for rent is available in kharadi in nyati elysia, pune. This flat consists of 2 bathrooms & 1 balcony build in 980 sq.Ft. Super built-Up area. Flat is constructed on 1050 sq.Ft. You get an additional space of study room. 1 covered parking available. 1 open parking available. Placed on 25th of 28 floor. This is a semi-Furnished flat. Furnishing options provided - 5 light, 3...",Prop Laksh 
534,Sarita Vihar,"2 BHK Flat for rent in Dattawadi, Pune","₹26,000","+ Deposit ₹70,000","11,000 sqft",2 BHK ,"['2 Baths', 'East Facing']","Pune's most popular society sarita vihar in dattawadi offers 2 bhk apartment. This flat consists of 2 bathrooms & 2 balconies build in 11000 sq.Ft. Super built-Up area. The flat consists of 2 bedrooms, built on 11000 sq.Ft. A separate space for others is available in this flat. The building has a total of 8 floors and this property is situated on 5th floor. Property is 10+ years old. This is a ...",shivkrupa real estate  
